{
  "settingId": "spuk_im_schlosskeller",
  "pfad": "basis",
  "hinweis": "Gemeinsamer Ablauf aller vier Pfade von 23:50 bis 0:10. Die Kernverdächtigen stehen hier mit ihrem unschuldigen Verhalten. Jede Pfaddatei ersetzt den Plan der Person, die zugeschlagen hat, und ergänzt Ereignisse und Gegenstandsspuren. Ein Plan besteht aus Schritten: Aufenthalt (t, ort, haltung), Weg (t, nach, bis, tempo, ueber), Haltungswechsel, Gesagtes (sagt, lautstaerke), Geräusch (geraeusch, lautstaerke) und getragenes Licht (licht).",
  "plaene": {
    "detective": [
      {
        "t": "23:50:00",
        "ort": "ost_tafel_ost",
        "haltung": "sitzt"
      },
      {
        "t": "23:55:00",
        "nach": "geburtstagsplatz",
        "bis": "23:55:10",
        "tempo": "gehen",
        "haltung": "augenbinde"
      },
      {
        "t": "00:00:35",
        "haltung": "sitzt"
      }
    ],
    "schneider": [
      {
        "t": "23:50:00",
        "ort": "vor_theke",
        "haltung": "steht"
      },
      {
        "t": "23:51:00",
        "sagt": "Um zwölf sag ich allen, was der Keller gekostet hat.",
        "lautstaerke": "laut"
      },
      {
        "t": "23:51:30",
        "nach": "an_der_vitrine",
        "bis": "23:52:30",
        "tempo": "gehen",
        "ueber": [
          "theke_klappe",
          "durchgang_mitte",
          "vor_bogentuer"
        ]
      },
      {
        "t": "23:53:00",
        "sagt": "Wer war an der Vitrine?",
        "lautstaerke": "laut"
      },
      {
        "t": "23:54:40",
        "nach": "am_linken_buffet",
        "bis": "23:55:50",
        "tempo": "gehen",
        "ueber": [
          "vor_bogentuer",
          "durchgang_mitte",
          "theke_klappe"
        ]
      },
      {
        "t": "23:56:00",
        "sagt": "Die Schatulle. Um Punkt zwölf geh ich raus und ruf die Polizei.",
        "lautstaerke": "laut"
      },
      {
        "t": "23:56:30",
        "nach": "theke_ostende",
        "bis": "23:56:50",
        "tempo": "gehen"
      },
      {
        "t": "23:57:00",
        "sagt": "Zweitausend, bis zwölf.",
        "lautstaerke": "laut"
      },
      {
        "t": "23:57:25",
        "nach": "hinter_theke_ost",
        "bis": "23:57:30",
        "tempo": "gehen"
      },
      {
        "t": "23:57:40",
        "sagt": "Nicht die alte Leiste!",
        "lautstaerke": "laut"
      },
      {
        "t": "23:58:05",
        "sagt": "Ruhe! Ich hol die Notlaterne.",
        "lautstaerke": "laut"
      },
      {
        "t": "23:58:05",
        "nach": "vor_vorratstuer",
        "bis": "23:58:09",
        "tempo": "gehen"
      },
      {
        "t": "23:58:13",
        "sagt": "Hab ich dich!",
        "lautstaerke": "sehr_laut"
      },
      {
        "t": "23:58:30",
        "sagt": "Stehen bleiben!",
        "lautstaerke": "sehr_laut"
      },
      {
        "t": "23:58:40",
        "nach": "vorrat_innen",
        "bis": "23:58:42",
        "tempo": "faellt",
        "haltung": "liegt"
      },
      {
        "t": "00:01:30",
        "haltung": "sitzt"
      },
      {
        "t": "00:01:35",
        "sagt": "Mein Kopf …",
        "lautstaerke": "leise"
      },
      {
        "t": "00:02:00",
        "sagt": "Mein Schlüsselbund! Der ist weg!",
        "lautstaerke": "laut"
      }
    ],
    "ahmet": [
      {
        "t": "23:50:00",
        "ort": "vor_theke",
        "haltung": "steht"
      },
      {
        "t": "23:53:00",
        "nach": "am_handykorb",
        "bis": "23:53:30",
        "tempo": "gehen"
      },
      {
        "t": "23:55:10",
        "nach": "am_jackenstaender",
        "bis": "23:55:30",
        "tempo": "gehen"
      },
      {
        "t": "23:56:50",
        "nach": "hinter_theke_ost",
        "bis": "23:56:58",
        "tempo": "gehen"
      },
      {
        "t": "23:58:00",
        "haltung": "kauert"
      },
      {
        "t": "23:58:03",
        "sagt": "Damir? Ich bin's, Ahmet.",
        "lautstaerke": "leise"
      },
      {
        "t": "00:00:05",
        "haltung": "steht"
      },
      {
        "t": "00:11:00",
        "nach": "am_kamin",
        "bis": "00:11:40",
        "tempo": "gehen",
        "ueber": [
          "theke_klappe",
          "durchgang_mitte"
        ]
      },
      {
        "t": "00:12:00",
        "geraeusch": "Papier raschelt im Ascheneimer",
        "lautstaerke": "leise"
      },
      {
        "t": "00:12:20",
        "nach": "vor_theke",
        "bis": "00:13:00",
        "tempo": "gehen",
        "ueber": [
          "durchgang_mitte",
          "theke_klappe"
        ]
      }
    ],
    "fatma": [
      {
        "t": "23:50:00",
        "ort": "am_linken_buffet",
        "haltung": "steht"
      },
      {
        "t": "23:57:00",
        "nach": "theke_klappe",
        "bis": "23:57:06",
        "tempo": "gehen"
      },
      {
        "t": "23:58:01",
        "nach": "hinter_linkem_buffet",
        "bis": "23:58:06",
        "tempo": "gehen",
        "haltung": "kauert"
      },
      {
        "t": "23:58:08",
        "sagt": "Emine? Ich bin's, Fatma.",
        "lautstaerke": "leise"
      },
      {
        "t": "00:00:05",
        "haltung": "steht"
      }
    ],
    "olli": [
      {
        "t": "23:50:00",
        "ort": "vor_bogentuer",
        "haltung": "steht"
      },
      {
        "t": "23:52:00",
        "sagt": "Ich hol dir Eis. Und dann red ich mit Schneider.",
        "lautstaerke": "leise"
      },
      {
        "t": "23:52:30",
        "nach": "ost_tafel_kopf",
        "bis": "23:54:00",
        "tempo": "gehen",
        "haltung": "sitzt"
      },
      {
        "t": "23:56:30",
        "nach": "am_eiskuebel",
        "bis": "23:56:50",
        "tempo": "gehen"
      },
      {
        "t": "23:58:01",
        "nach": "am_rechten_buffet",
        "bis": "23:58:05",
        "tempo": "gehen",
        "haltung": "kauert"
      },
      {
        "t": "23:58:08",
        "sagt": "Azra? Ich bin's, Olli.",
        "lautstaerke": "leise"
      },
      {
        "t": "00:00:05",
        "haltung": "steht"
      },
      {
        "t": "00:00:30",
        "nach": "vor_bogentuer",
        "bis": "00:00:55",
        "tempo": "gehen",
        "haltung": "steht",
        "ueber": [
          "theke_klappe",
          "durchgang_mitte"
        ]
      },
      {
        "t": "00:01:00",
        "sagt": "Hier, dein Eis. Sorry, hat gedauert.",
        "lautstaerke": "leise"
      },
      {
        "t": "00:01:30",
        "nach": "ost_tafel_kopf",
        "bis": "00:02:10",
        "tempo": "gehen",
        "ueber": [
          "durchgang_mitte",
          "theke_klappe"
        ],
        "haltung": "sitzt"
      }
    ],
    "can": [
      {
        "t": "23:50:00",
        "ort": "west_bank_west",
        "haltung": "sitzt"
      },
      {
        "t": "23:54:00",
        "nach": "vorrat_mitte",
        "bis": "23:54:20",
        "tempo": "gehen",
        "ueber": [
          "durchgang_mitte",
          "theke_klappe",
          "vor_vorratstuer"
        ]
      },
      {
        "t": "23:54:20",
        "licht": "licht_maske",
        "an": true
      },
      {
        "t": "23:57:00",
        "nach": "vorrat_innen",
        "bis": "23:57:03",
        "tempo": "gehen"
      },
      {
        "t": "23:58:09",
        "nach": "vor_vorratstuer",
        "bis": "23:58:11",
        "tempo": "gehen"
      },
      {
        "t": "23:58:11",
        "sagt": "Buuuh!",
        "lautstaerke": "laut"
      },
      {
        "t": "23:58:28",
        "nach": "vor_bogentuer",
        "bis": "23:58:34",
        "tempo": "rennen",
        "ueber": [
          "theke_klappe",
          "durchgang_mitte"
        ]
      },
      {
        "t": "23:58:35",
        "licht": "licht_maske",
        "an": false
      },
      {
        "t": "23:58:36",
        "nach": "wc",
        "bis": "23:58:55",
        "tempo": "gehen"
      },
      {
        "t": "00:01:00",
        "nach": "west_bank_west",
        "bis": "00:01:30",
        "tempo": "gehen"
      }
    ],
    "leyla": [
      {
        "t": "23:50:00",
        "ort": "hinter_theke_mitte",
        "haltung": "steht"
      },
      {
        "t": "23:57:40",
        "nach": "ost_tafel_west",
        "bis": "23:57:50",
        "tempo": "gehen"
      }
    ],
    "tim": [
      {
        "t": "23:50:00",
        "ort": "hinter_theke_ost",
        "haltung": "steht"
      },
      {
        "t": "23:58:00",
        "nach": "am_sicherungskasten",
        "bis": "23:58:14",
        "tempo": "gehen"
      },
      {
        "t": "23:58:20",
        "sagt": "Wo ist denn der Hauptschalter …",
        "lautstaerke": "leise"
      },
      {
        "t": "23:59:40",
        "licht": "licht_stirnlampe",
        "an": true
      }
    ],
    "emine": [
      {
        "t": "23:50:00",
        "ort": "hinter_linkem_buffet",
        "haltung": "steht"
      },
      {
        "t": "23:58:00",
        "haltung": "kauert"
      },
      {
        "t": "00:00:05",
        "haltung": "steht"
      }
    ],
    "johanna": [
      {
        "t": "23:50:00",
        "ort": "saalmitte",
        "haltung": "steht"
      },
      {
        "t": "23:53:00",
        "nach": "am_handykorb",
        "bis": "23:53:30",
        "tempo": "gehen"
      }
    ],
    "murat": [
      {
        "t": "23:50:00",
        "ort": "unter_notausgang",
        "haltung": "steht"
      },
      {
        "t": "23:57:00",
        "nach": "bei_den_kisten",
        "bis": "23:57:20",
        "tempo": "gehen",
        "ueber": [
          "theke_klappe"
        ]
      }
    ],
    "zeynep": [
      {
        "t": "23:50:00",
        "ort": "west_bank_west",
        "haltung": "sitzt"
      },
      {
        "t": "23:54:00",
        "nach": "west_bogen",
        "bis": "23:54:10",
        "tempo": "gehen",
        "haltung": "steht"
      }
    ],
    "baran": [
      {
        "t": "23:50:00",
        "ort": "ost_bank",